{"schema":"cthd.wsc-stations/1","generatedAt":"2026-10-05T08:12:27.588Z","sourceIds":["eccc-hydrometric-stations"],"stations":[
{"id":"wsc:07EA004","name":"INGENIKA RIVER ABOVE SWANNELL RIVER","lat":56.73061,"lon":-125.105,"region":"bc","timeZone":"America/Vancouver","links":{"wateroffice":"https://wateroffice.ec.gc.ca/report/real_time_e.html?stn=07EA004"},"stages":null,"thresholdNote":"No official flood thresholds are published for this station; see BC River Forecast Centre advisories.","nationIds":["ca-fn-609"]},
{"id":"wsc:07EA005","name":"FINLAY RIVER ABOVE AKIE RIVER","lat":57.12622,"lon":-125.24992,"region":"bc","timeZone":"America/Vancouver","links":{"wateroffice":"https://wateroffice.ec.gc.ca/report/real_time_e.html?stn=07EA005"},"stages":null,"thresholdNote":"No official flood thresholds are published for this station; see BC River Forecast Centre advisories.","nationIds":[]},
{"id":"wsc:07EA007","name":"AKIE RIVER NEAR THE 760 M CONTOUR","lat":57.19111,"lon":-124.90111,"region":"bc","timeZone":"America/Vancouver","links":{"wateroffice":"https://wateroffice.ec.gc.ca/report/real_time_e.html?stn=07EA007"},"stages":null,"thresholdNote":"No official flood thresholds are published for this station; see BC River Forecast Centre advisories.","nationIds":[]},
{"id":"wsc:07EB002","name":"OSPIKA RIVER ABOVE ALEY CREEK","lat":56.52411,"lon":-123.93603,"region":"bc","timeZone":"America/Vancouver","links":{"wateroffice":"https://wateroffice.ec.gc.ca/report/real_time_e.html?stn=07EB002"},"stages":null,"thresholdNote":"No official flood thresholds are published for this station; see BC River Forecast Centre advisories.","nationIds":[]},
{"id":"wsc:07EC002","name":"OMINECA RIVER ABOVE OSILINKA RIVER","lat":55.91686,"lon":-124.56758,"region":"bc","timeZone":"America/Vancouver","links":{"wateroffice":"https://wateroffice.ec.gc.ca/report/real_time_e.html?stn=07EC002"},"stages":null,"thresholdNote":"No official flood thresholds are published for this station; see BC River Forecast Centre advisories.","nationIds":[]},
{"id":"wsc:07EC003","name":"MESILINKA RIVER ABOVE GOPHERHOLE CREEK","lat":56.245,"lon":-124.64467,"region":"bc","timeZone":"America/Vancouver","links":{"wateroffice":"https://wateroffice.ec.gc.ca/report/real_time_e.html?stn=07EC003"},"stages":null,"thresholdNote":"No official flood thresholds are published for this station; see BC River Forecast Centre advisories.","nationIds":[]},
{"id":"wsc:07EC004","name":"OSILINKA RIVER NEAR END LAKE","lat":56.12694,"lon":-124.80192,"region":"bc","timeZone":"America/Vancouver","links":{"wateroffice":"https://wateroffice.ec.gc.ca/report/real_time_e.html?stn=07EC004"},"stages":null,"thresholdNote":"No official flood thresholds are published for this station; see BC River Forecast Centre advisories.","nationIds":[]},
{"id":"wsc:07ED001","name":"NATION RIVER NEAR FORT ST. JAMES","lat":55.20253,"lon":-124.23337,"region":"bc","timeZone":"America/Vancouver","links":{"wateroffice":"https://wateroffice.ec.gc.ca/report/real_time_e.html?stn=07ED001"},"stages":null,"thresholdNote":"No official flood thresholds are published for this station; see BC River Forecast Centre advisories.","nationIds":[]},
{"id":"wsc:07ED003","name":"NATION RIVER NEAR THE MOUTH","lat":55.42722,"lon":-123.63336,"region":"bc","timeZone":"America/Vancouver","links":{"wateroffice":"https://wateroffice.ec.gc.ca/report/real_time_e.html?stn=07ED003"},"stages":null,"thresholdNote":"No official flood thresholds are published for this station; see BC River Forecast Centre advisories.","nationIds":[]},
{"id":"wsc:07EE007","name":"PARSNIP RIVER ABOVE MISINCHINKA RIVER","lat":55.08194,"lon":-122.91306,"region":"bc","timeZone":"America/Vancouver","links":{"wateroffice":"https://wateroffice.ec.gc.ca/report/real_time_e.html?stn=07EE007"},"stages":null,"thresholdNote":"No official flood thresholds are published for this station; see BC River Forecast Centre advisories.","nationIds":["ca-fn-618"]},
{"id":"wsc:07EE009","name":"CHUCHINKA CREEK NEAR THE MOUTH","lat":54.52972,"lon":-122.61222,"region":"bc","timeZone":"America/Vancouver","links":{"wateroffice":"https://wateroffice.ec.gc.ca/report/real_time_e.html?stn=07EE009"},"stages":null,"thresholdNote":"No official flood thresholds are published for this station; see BC River Forecast Centre advisories.","nationIds":[]},
{"id":"wsc:07EE010","name":"PACK RIVER AT OUTLET OF MCLEOD LAKE","lat":54.9985,"lon":-123.03656,"region":"bc","timeZone":"America/Vancouver","links":{"wateroffice":"https://wateroffice.ec.gc.ca/report/real_time_e.html?stn=07EE010"},"stages":null,"thresholdNote":"No official flood thresholds are published for this station; see BC River Forecast Centre advisories.","nationIds":["ca-fn-618"]},
{"id":"wsc:07EF002","name":"WILLISTON LAKE AT LOST CABIN CREEK","lat":56.04997,"lon":-123.74819,"region":"bc","timeZone":"America/Vancouver","links":{"wateroffice":"https://wateroffice.ec.gc.ca/report/real_time_e.html?stn=07EF002"},"stages":null,"thresholdNote":"No official flood thresholds are published for this station; see BC River Forecast Centre advisories.","nationIds":[]},
{"id":"wsc:07EF003","name":"WILLISTON LAKE NEAR SCHOOLER CREEK","lat":56.10639,"lon":-122.71611,"region":"bc","timeZone":"America/Vancouver","links":{"wateroffice":"https://wateroffice.ec.gc.ca/report/real_time_e.html?stn=07EF003"},"stages":null,"thresholdNote":"No official flood thresholds are published for this station; see BC River Forecast Centre advisories.","nationIds":[]},
{"id":"wsc:07EF004","name":"CARBON CREEK NEAR THE MOUTH","lat":55.94611,"lon":-122.65889,"region":"bc","timeZone":"America/Vancouver","links":{"wateroffice":"https://wateroffice.ec.gc.ca/report/real_time_e.html?stn=07EF004"},"stages":null,"thresholdNote":"No official flood thresholds are published for this station; see BC River Forecast Centre advisories.","nationIds":[]},
{"id":"wsc:07FA003","name":"HALFWAY RIVER ABOVE GRAHAM RIVER","lat":56.50894,"lon":-122.24322,"region":"bc","timeZone":"America/Dawson_Creek","links":{"wateroffice":"https://wateroffice.ec.gc.ca/report/real_time_e.html?stn=07FA003"},"stages":null,"thresholdNote":"No official flood thresholds are published for this station; see BC River Forecast Centre advisories.","nationIds":["ca-fn-546"]},
{"id":"wsc:07FA004","name":"PEACE RIVER ABOVE PINE RIVER","lat":56.19933,"lon":-120.8145,"region":"bc","timeZone":"America/Dawson_Creek","links":{"wateroffice":"https://wateroffice.ec.gc.ca/report/real_time_e.html?stn=07FA004"},"stages":null,"thresholdNote":"No official flood thresholds are published for this station; see BC River Forecast Centre advisories.","nationIds":[]},
{"id":"wsc:07FA005","name":"GRAHAM RIVER ABOVE COLT CREEK","lat":56.45986,"lon":-122.35453,"region":"bc","timeZone":"America/Dawson_Creek","links":{"wateroffice":"https://wateroffice.ec.gc.ca/report/real_time_e.html?stn=07FA005"},"stages":null,"thresholdNote":"No official flood thresholds are published for this station; see BC River Forecast Centre advisories.","nationIds":["ca-fn-546"]},
{"id":"wsc:07FA006","name":"HALFWAY RIVER NEAR FARRELL CREEK","lat":56.25075,"lon":-121.62853,"region":"bc","timeZone":"America/Dawson_Creek","links":{"wateroffice":"https://wateroffice.ec.gc.ca/report/real_time_e.html?stn=07FA006"},"stages":null,"thresholdNote":"No official flood thresholds are published for this station; see BC River Forecast Centre advisories.","nationIds":[]},
{"id":"wsc:07FB001","name":"PINE RIVER AT EAST PINE","lat":55.71844,"lon":-121.21156,"region":"bc","timeZone":"America/Dawson_Creek","links":{"wateroffice":"https://wateroffice.ec.gc.ca/report/real_time_e.html?stn=07FB001"},"stages":null,"thresholdNote":"No official flood thresholds are published for this station; see BC River Forecast Centre advisories.","nationIds":[]},
{"id":"wsc:07FB002","name":"MURRAY RIVER NEAR THE MOUTH","lat":55.55247,"lon":-121.2035,"region":"bc","timeZone":"America/Dawson_Creek","links":{"wateroffice":"https://wateroffice.ec.gc.ca/report/real_time_e.html?stn=07FB002"},"stages":null,"thresholdNote":"No official flood thresholds are published for this station; see BC River Forecast Centre advisories.","nationIds":[]},
{"id":"wsc:07FB003","name":"SUKUNKA RIVER NEAR THE MOUTH","lat":55.54217,"lon":-121.62756,"region":"bc","timeZone":"America/Dawson_Creek","links":{"wateroffice":"https://wateroffice.ec.gc.ca/report/real_time_e.html?stn=07FB003"},"stages":null,"thresholdNote":"No official flood thresholds are published for this station; see BC River Forecast Centre advisories.","nationIds":[]},
{"id":"wsc:07FB004","name":"DICKEBUSCH CREEK NEAR THE MOUTH","lat":55.53778,"lon":-121.59681,"region":"bc","timeZone":"America/Dawson_Creek","links":{"wateroffice":"https://wateroffice.ec.gc.ca/report/real_time_e.html?stn=07FB004"},"stages":null,"thresholdNote":"No official flood thresholds are published for this station; see BC River Forecast Centre advisories.","nationIds":[]},
{"id":"wsc:07FB006","name":"MURRAY RIVER ABOVE WOLVERINE RIVER","lat":55.06136,"lon":-121.01378,"region":"bc","timeZone":"America/Dawson_Creek","links":{"wateroffice":"https://wateroffice.ec.gc.ca/report/real_time_e.html?stn=07FB006"},"stages":null,"thresholdNote":"No official flood thresholds are published for this station; see BC River Forecast Centre advisories.","nationIds":[]},
{"id":"wsc:07FB008","name":"MOBERLY RIVER NEAR FORT ST. JOHN","lat":56.0925,"lon":-121.36678,"region":"bc","timeZone":"America/Dawson_Creek","links":{"wateroffice":"https://wateroffice.ec.gc.ca/report/real_time_e.html?stn=07FB008"},"stages":null,"thresholdNote":"No official flood thresholds are published for this station; see BC River Forecast Centre advisories.","nationIds":[]},